{
  "id": "Q1",
  "subject": "数学",
  "content": "解方程 2x + 5 = 15",
  "answer": "x = 5",
  "maxScore": 10,
  "type": "single",
  "criteria": [
    { "step": "设未知数", "score": 2, "desc": "设元正确" },
    { "step": "列方程", "score": 4, "desc": "方程正确" },
    { "step": "求解并作答", "score": 4, "desc": "结果正确且表述规范" }
  ],
  "ignore_rules": ["忽略题号"]
}
